{
  "command": "doctor",
  "overall": "healthy",
  "checks": [
    {
      "name": "config",
      "status": "healthy",
      "message": "Config syntax valid",
      "duration_ms": 0
    },
    {
      "name": "state",
      "status": "healthy",
      "message": "State store healthy (1 watermarks)",
      "duration_ms": 0
    },
    {
      "name": "state_schema",
      "status": "healthy",
      "message": "state schema v34 matches this binary",
      "duration_ms": 0
    },
    {
      "name": "adapters",
      "status": "healthy",
      "message": "1 adapter(s) configured",
      "duration_ms": 0
    },
    {
      "name": "pipelines",
      "status": "healthy",
      "message": "1 pipeline(s) valid",
      "duration_ms": 0
    },
    {
      "name": "state_sync",
      "status": "healthy",
      "message": "State backend: local",
      "duration_ms": 0
    },
    {
      "name": "state_rw",
      "status": "healthy",
      "message": "Local backend \u2014 no remote probe needed",
      "duration_ms": 0
    },
    {
      "name": "auth/default",
      "status": "healthy",
      "message": "Authenticated to default",
      "duration_ms": 0
    },
    {
      "name": "auth",
      "status": "healthy",
      "message": "All 1 warehouse adapter(s) authenticated",
      "duration_ms": 0
    },
    {
      "name": "auth/default",
      "status": "healthy",
      "message": "Discovery adapter default reachable",
      "duration_ms": 0
    }
  ],
  "suggestions": []
}
